	en	fr	es	el	ar
keyframes_title	Video fragmentation and reverse image search	Fragmentation vidéo et recherche inversée d'image	Fragmentación del video y búsqueda inversa de imagen	Αντίστροφη αναζήτηση βίντεο μέσω χαρακτηριστικών καρε	تقطيع الفيديو والبحث عن الصور العكسي
button_localfile	Local file	Fichier local	Fichero local	Τοπικό αρχείο	ملف محلي
keyframes_input	Insert the video URL	Adresse de la vidéo	Enlace del video	Εισάγετε τη διεύθυνση URL του βίντεο	أدخل عنوان URL الفيديو
keyframes_input_placeholder	Paste the link here	Coller le lien ici	Pegar el enlace aquí	Επικολλήστε τον σύνδεσμο εδώ	الصق الرابط هنا
button_submit	Submit	Envoyer	Enviar	Υποβολή	إرسال
forensic_card_back	Back	Retour	Volver	Πίσω	عودة
keyframes_error_VIDEO_DOWNLOAD_FAILED	Video cache failed. Try with another video	La mise en cache de la vidéo à échoué. Veuillez essayer avec une autre vidéo	Falló el almacenamiento en caché del video. Inténtalo con otro vídeo	Η προσωρινή αποθήκευση του βίντεο απέτυχε. Δοκιμάστε με ένα άλλο βίντεο	فشل ذاكرة التخزين المؤقت للفيديو. جرب فيديو آخر
keyframes_error_VIDEO_DOWNLOAD_TIMEOUT	Video cache failed. The video cache has timed out	La mise en cache de la vidéo à échoué. La vidéo a mis trop de temps à charger	Falló el almacenamiento en caché del video. El tiempo de espera se ha agotado.	Η προσωρινή αποθήκευση του βίντεο απέτυχε. Το χρονικό διάστημα προσπάθειας προσωρινής αποθήκευσης βίντεο έληξε	فشل ذاكرة التخزين المؤقت للفيديو. تم توقيت ذاكرة التخزين المؤقت للفيديو
keyframes_error_VIDEO_SEGMENTATION_FAILED	Video segmentation analysis failed	L'analyse de segmentation vidéo à échoué	Fallo en el análisis de segmentación de vídeo	Η τμηματοποίηση του βίντεο απέτυχε	فشل تحليل المقطع المختار من الفيديو
keyframes_error_PROCESS_INTERRUPTED	Video analysis interrupted due to unknown cause. Please re-submit the video	L'analyse de la vidéo à été interrompue dû à une cause inconnue. Veuillez ré-envoyer la vidéo	El análisis de vídeo se interrumpió debido a una causa desconocida. Por favor, vuelva a enviar el vídeo	Η ανάλυση του βίντεο διακόπηκε λόγω άγνωστης αιτίας. Παρακαλώ, υποβάλετε ξανά το βίντεο	توقف تحليل الفيديو لسبب غير معروف. يرجى إعادة تقديم الفيديو
keyframes_error_ANALYSIS_STOPPED_CORRUPTED_VIDEO_FILE	Video analysis quitted due to corrupted video file	L'analyse de la vidéo s'est arrêté dû à des fichiers vidéos corrompus	El análisis de vídeo se ha interrumpido debido a que el archivo de vídeo está dañado.	Η ανάλυση του βίντεο τερματίστηκε λόγω κατεστραμμένου αρχείου βίντεο	توقف تحليل الفيديو بسبب ملف الفيديو التالف
keyframes_error_ANALYSIS_STOPPED_UNSUPPORTED_FILE_EXTENSION	Video analysis quitted due to unsupported file extension	L'analyse de la vidéo s'est arrêté dû à un format vidéo non supporté	El análisis de vídeo se ha interrumpido debido a que la extensión del archivo no es compatible.	Η ανάλυση του βίντεο τερματίστηκε λόγω μη υποστηριζόμενης επέκτασης αρχείου	توقف تحليل الفيديو بسبب امتداد الملف غير المدعوم
keyframes_error_MAX_VIDEO_DURATION_EXCEEDED	Video duration overcomes the limit	La durée de la video est trop élevée	La duración del video sobrepasa el límite	Η διάρκεια του βίντεο ξεπερνά το όριο	مدة الفيديو أعلى من الحد المسموح
keyframes_error_unavailable	The service is currently unavailable. Try again later	Le service est actuellement indisponible. Veuillez réessayez plus tard	El servicio no está disponible en este momento. Inténtalo de nuevo más tarde	Η υπηρεσία αυτή τη στιγμή δεν είναι διαθέσιμη. Προσπαθήστε ξανά αργότερα	الخدمة غير متوفرة حاليا. حاول مرة أخرى في وقت لاحق
keyframes_error_default	Unknown error occured. Please try again later or with another video.	Une erreur inconnue s'est produite. Veuillez réessayer plus tard ou avec une autre vidéo.	Se ha producido un error desconocido. Por favor, inténtelo de nuevo más tarde o con otro vídeo.	Παρουσιάστηκε άγνωστο σφάλμα. Δοκιμάστε ξανά αργότερα ή με άλλο βίντεο.	حدث خطأ غير معروف. يرجى المحاولة مرة أخرى لاحقًا أو مع فيديو آخر.
keyframes_wait_VIDEO_WAITING_IN_QUEUE	Video in queue for analysis. The analysis of your video will start immediately after all preceding videos in the queue have been processed	Vidéo en file d'attente pour analyse. L'analyse de votre vidéo commencera immédiatement après que toutes les vidéos précédentes de la file d'attente auront été traitées	Vídeo en cola para análisis. El análisis de su vídeo se iniciará inmediatamente después de que se hayan procesado todos los vídeos anteriores de la cola.	Το βίντεο προστέθηκε στην ουρά για ανάλυση. Η ανάλυση του βίντεό σας θα ξεκινήσει αμέσως μετά την επεξεργασία όλων των προηγούμενων βίντεο στην ουρά	الفيديو في قائمة الانتظار للتحليل. سيبدأ تحليل الفيديو الخاص بك فورا بعد معالجة جميع مقاطع الفيديو السابقة في قائمة الانتظار
keyframes_wait_VIDEO_DOWNLOAD_STARTED	The video is being cached before its analysis	La vidéo est mise en cache pour analyse.	El video se almacena en caché antes del análisis.	το βίντεο αποθηκεύεται στην κρυφή μνήμη πριν από την ανάλυση.	يتم تخزين الفيديو مؤقتًا قبل تحليله
keyframes_wait_STARTED	Video analysis running. Step	Analyse de la vidéo en cours. Etape	Análisis de vídeo en marcha. Paso	Εκτελείται η ανάλυση του βίντεο. Βήμα	تحليل الفيديو قيد التشغيل. خطوة
keyframes_content_title	Video keyframes	Images clés de la vidéo	Imágenes claves del video	Χαρακτηριστικά καρε	إطارات الفيديو
keyframe_title_get_detail	Show detailed view	Afficher la vue détaillée	Mostrar la vista detallada	Εμφάνιση λεπτομερούς προβολής	عرض المحتوى بالتفصيل
keyframe_title_get_simple	Show simple view	Afficher la vue minimal	Mostrar vista simple	Εμφάνιση απλής προβολής	إظهار عرض بسيط
keyframes_download_subshots	Download keyframes	Télecharger les images clés	Descargar imágenes claves	Λήψη χαρακτηριστικών καρέ	قم بتنزيل إطارات المفاتيح
zoom_in	zoom in	augmenter	aumentar	μεγεθύνετε	تكبير
zoom_out	zoom out	réduire	reducir	Σμίκρυνση	تصغير
cardheader_source	Source of the video	Source de la vidéo	Fuente del video	Πηγή του βίντεο	مصدر الفيديو
cardheader_results	Results	Résultats	Resultados	Αποτελέσματα	النتائج
linkmode_title	Link	Lien	Enlace	Σύνδεσμος	رابط
linkmode_description	The video to fragment into keyframes is provided with a URL Link	La vidéo à fragmenter en images clés est fournie avec un lien URL	El video a fragmentar en fotogramas clave se proporciona con un enlace URL	Το βίντεο που πρόκειται να κατακερματιστεί σε keyframes παρέχεται με έναν σύνδεσμο URL	يتم توفير الفيديو المراد تجزئته إلى إطارات رئيسية عن طريق رابط URL
filemode_title	File	Fichier	Fichero	αρχείου	ملف
filemode_description	The video to fragment is provided with a local file	La vidéo à fragmenter est fournie avec un fichier local	El video a fragmentar se proporciona con un archivo local.	Το βίντεο προς κατακερματισμό παρέχεται με ένα τοπικό αρχείο	يتم توفير الفيديو المراد تجزئته إلى إطارات رئيسية عن طريق ملف محلي URL
loading_dbkf	Loading dbkf	Chargement de DBKF	Cargando dbkf	Φόρτωση DBKF	تحميل DBKF
found_dbkf	Video found in the DBKF database	Vidéo trouvée dans la base de données DBKF	Video encontrado en la base de datos DBKF	Βίντεο που βρέθηκαν στη βάση δεδομένων DBKF	الفيديو موجود في قاعدة بيانات DBKF
dbkf_articles	The video has been found in the next articles:	La vidéo a été trouvée dans les articles suivants:	El video se ha encontrado en los siguientes artículos:	Το βίντεο βρέθηκε στα επόμενα άρθρα:	تم العثور على الفيديو في المقالات التالية:
keyframes_error_VIDEO_SIMILARITY	The video search in the DBKF failed and the results will not be displayed	La recherche de vidéos dans le DBKF a échoué et les résultats ne s'affichent pas.	La búsqueda de vídeos en DBKF ha fallado y los resultados no serán mostrados	Η αναζήτηση βίντεο στο DBKF απέτυχε και τα αποτελέσματα δεν εμφανίζοντ	فشل بحث الفيديو في DBKF ولن يتم عرض النتائج
dbkf_threshold	0.6	0.6	0.6	0.6	0.6