	en	fr
ERR_AUTH_UNKNOWN_ERROR	Application has raised an unknown error	L'application a rencontré une erreur inconnue
ERR_AUTH_INVALID_PARAMS	Invalid parameters	Paramètres invalides
ERR_AUTH_BAD_REQUEST	Invalid request sent to the service	Requête invalide envoyée au service
ERR_AUTH_SERVER_ERROR	Service not available or in error state	Service indisponible ou en erreur
ERR_AUTH_INVALID_TOKEN	Authentication token is invalid	Le token d'authentification est invalide
ERR_AUTH_INVALID_CREDENTIALS	Invalid authentifcation information	Les informations d'authentification sont invalides
ERR_AUTH_INVALID_USER_STATE	User account's state is invalid	L'état du compte utilisateur est invalide
ERR_AUTH_USER_EXPIRED	User account is expired	Le compte utilisateur a expiré
ERR_AUTH_SESSION_EXPIRED	Your session has expired	Votre session a expirée
REGISTRATIONFORM_EMAIL_LABEL	Email	Email
REGISTRATIONFORM_EMAIL_PLACEHOLDER	Enter your email address	Saisissez votre adresse mail
REGISTRATIONFORM_EMAIL_ERR_REQUIRED	Email address is required	Veuillez saisir une address mail
REGISTRATIONFORM_EMAIL_ERR_EMAIL	Email address must be valid	L'adresse email est invalide
REGISTRATIONFORM_FIRSTNAME_LABEL	First name	Prénom
REGISTRATIONFORM_FIRSTNAME_PLACEHOLDER	Enter your first name	Saisissez votre prénom
REGISTRATIONFORM_FIRSTNAME_ERR_REQUIRED	Firstname is required	Veuillez saisir votre prénom
REGISTRATIONFORM_LASTNAME_LABEL	Last name	Nom
REGISTRATIONFORM_LASTNAME_PLACEHOLDER	Enter your last name	Saisissez votre nom
REGISTRATIONFORM_LASTNAME_ERR_REQUIRED	Lastname is required	Veuillez saisir votre nom
REGISTRATIONFORM_COMPANY_LABEL	Company	Entreprise
REGISTRATIONFORM_COMPANY_PLACEHOLDER	Enter your company name	Saisissez le nom de votre entreprise
REGISTRATIONFORM_COMPANY_ERR_REQUIRED	Company is required	Veuillez saisir le nom de votre entreprise
REGISTRATIONFORM_POSITION_LABEL	Position	Qualité
REGISTRATIONFORM_POSITION_PLACEHOLDER	Enter your position	Saisissez votre qualité
REGISTRATIONFORM_POSITION_ERR_REQUIRED	Position is required	Veuillez saisir votre qualité
REGISTRATIONFORM_BUTTON_LABEL	Register	S'enregistrer
ACCESSCODEFORM_EMAIL_LABEL	Email	Email
ACCESSCODEFORM_EMAIL_PLACEHOLDER	Enter your email address	Saisissez votre adresse mail
ACCESSCODEFORM_EMAIL_ERR_REQUIRED	Email address is required	Veuillez saisir une addresse mail
ACCESSCODEFORM_EMAIL_ERR_EMAIL	Email address must be valid	L'adresse mail est invalide
ACCESSCODEFORM_BUTTON_LABEL	Get an Access Code	Obtenir un code d'accès
LOGINFORM_ACCESSCODE_LABEL	Access Code	Code d'accès
LOGINFORM_ACCESSCODE_PLACEHOLDER	Enter your access code	Saisissez votre code d'accès
LOGINFORM_ACCESSCODE_ERR_REQUIRED	Access code is required	Veuillez saisir un code d'accès
LOGINFORM_BUTTON_LABEL	Log in	S'identifier