	en	fr	es	el	hy
twittersna_sosem_graph_tip	This socio-semantic graph measures interactions between hashtags and actors as nodes. Thickness of edges reflects the intensity of interactions. Clicking on nodes will display below the graph the corresponding tweets.	Ce graphe socio-sémantique mesure les interactions entre les hashtags et les acteurs (nœuds du graphe). L'épaisseur des arrêtes reflète l'intensité des interactions. En cliquant sur les nœuds, les tweets correspondants s'affichent sous le graphe.	Este grafo socio-semántico mide las interacciones entre los hashtags y los actores como nodos. El grosor de los enlaces refleja la intensidad de las interacciones. Al cliquear en los nodos se muestran debajo del grafo los tweets correspondientes.	Αυτό το κοινωνικο-σημασιολογικό γράφημα μετρά τις αλληλεπιδράσεις μεταξύ hashtags και actors ως κόμβους. Το πάχος των ακμών αντικατοπτρίζει την ένταση των αλληλεπιδράσεων. Κάνοντας κλικ σε κόμβους θα εμφανιστούν κάτω από το γράφημα τα αντίστοιχα tweets.	Այս սոցիալ-իմաստային գրաֆիկը չափում է հեշթեգների և դերակատարների միջև փոխազդեցությունները որպես հանգույցներ: Եզրերի հաստությունը արտացոլում է փոխազդեցության ինտենսիվությունը: Սեղմելով հանգույցների վրա, գրաֆիկի տակ կցուցադրվեն համապատասխան թվիթները:
twittersna_sosem_4mode_graph_tip	This socio-semantic graph measures interactions between hashtags, URLs, mentions, RTs with comment and replies as nodes. Thickness of edges reflects the intensity of interactions. Click on any node to get the corresponding tweets.	Ce graphe socio-sémantique mesure les interactions entre les hashtags, URLs, les mentions, les RTs avec commentaire et les réponses. L'épaisseur des arrêtes reflète l'intensité des interactions. En cliquant sur les nœuds, les tweets correspondants s'affichent sous le graphe.	Este grafo socio-semántico mide las interacciones entre los hashtags, URLs, las menciones, los RTs con comentario y las respuestas. El grosor de los enlaces refleja la intensidad de las interacciones. Al cliquear en cualquier nodo se muestra debajo del grafo los tweets correspondientes.	Αυτό το κοινωνικο-σημασιολογικό γράφημα μετρά τις αλληλεπιδράσεις μεταξύ hashtag, URLs, αναφορών, RT με σχόλια και απαντήσεις ως κόμβους. Το πάχος των ακμών αντικατοπτρίζει την ένταση των αλληλεπιδράσεων. Κάντε κλικ σε οποιονδήποτε κόμβο για να λάβετε τα αντίστοιχα tweets.	Այս սոցիալ-իմաստային գրաֆիկը չափում է հեշթեգների, URL-ների, հիշատակումների, մեկնաբանությունների և պատասխանների միջև փոխազդեցությունները՝ որպես հանգույց: Եզրերի հաստությունը արտացոլում է փոխազդեցության ինտենսիվությունը: Սեղմեք ցանկացած հանգույցի վրա՝ համապատասխան թվիթները ստանալու համար:
twittersna_acd_ts_tip	Stacked histogram of creation date of the accounts retrieved from your query	Histogramme empilé des dates de création des comptes récupérés dans votre requête	Histograma apilado de las fechas de creación de las cuentas recuperadas con su búsqueda	Ιστογράμματος σε μορφή στοίβας των ημερομηνιών δημιουργίας των λογαριασμών που ανακτήθηκαν από το ερώτημά σας	Ձեր հարցումից վերցված հաշիվների ստեղծման ամսաթվի կուտակված հիստոգրամ
twittersna_bubble_chart_tip	This graphic displays the most active accounts with their creation date (x axis) and their number of followers (y axis). The size of the nodes reflects their level of activity on your query. The rhombus shape means verified accounts. Colors show account activity on your query (Blue: less than 5 tweets per day; Orange: between 5 and 14 tweets per day; Red: beyond 15 tweets per day).	Ce graphique affiche les comptes les plus actifs avec leur date de création (axe x) et leur nombre de followers (axe y). La taille des nœuds reflète leur niveau d'activité sur votre requête. Les noeuds en losange sont les comptes vérifiés. Les couleurs montrent l'activité des comptes (Bleu: moins de 5 tweets par jour; Orange: entre 5 et 14 tweets par jour; Rouge: 15 ou plus tweets par jour).	Este gráfico muestra las cuentas más activas con su fecha de creación (eje x) y su número de seguidores (eje y). El tamaño de los nodos refleja su nivel de actividad en su consulta. Los nodos en rombos son cuentas verificadas. Los colores muestran la actividad de las cuentas (Azul: menos de 5 tweets por dia; Naranja: entre 5 y 14 tweets por dia; Rojo: 15 o más tweets por dia).	Αυτό το γραφικό εμφανίζει τους πιο ενεργούς λογαριασμούς με την ημερομηνία δημιουργίας τους (άξονας x) και τον αριθμό των ακολούθων τους (άξονας y). Το μέγεθος των κόμβων αντικατοπτρίζει το επίπεδο δραστηριότητάς τους στο ερώτημά σας. Οι κόμβοι στο ρόμβο είναι επαληθευμένοι λογαριασμοί. Τα χρώματα δείχνουν τη δραστηριότητα του λογαριασμού στο ερώτημά σας (Μπλε: λιγότερα από 5 tweets την ημέρα; Πορτοκαλί: μεταξύ 5 και 14 tweets την ημέρα; Κόκκινο: πέρα από 15 tweets την ημέρα).	Այս գրաֆիկում ցուցադրվում են ամենաակտիվ հաշիվները՝ իրենց ստեղծման ամսաթվով (x առանցք) և հետևորդների քանակով (y առանցք): Հանգույցների չափը արտացոլում է նրանց գործունեության մակարդակը ձեր հարցման վրա: Ռոմբի ձևը նշանակում է ստուգված հաշիվներ: Գույները ցույց են տալիս ձեր հարցմանը հաշվի ակտիվությունը (կապույտ՝ օրական 5 թվիթից պակաս, նարնջագույն՝ օրական 5-ից 14 թվիթ, կարմիր՝ օրական 15 թվիթից ավելի):
covid19_tip	This a customised search engine using Google CSE to query several sources of factchecks in one go. It was developed during the #EUvsVirus hackathon in April 2020	Ce moteur de recherche sur les factchecks est basé sur Google CSE. Il permet d'interroger de multiples sources en une requête. Cette fonctionnalité a été développé pendant le hackathon EUvsVirus de la Commission Européenne en avril 2020.	Este motor de busqueda se basa en Google CSE para interogar multiples chequeos en una búsqueda. Fue desarrollado durante el hackathon EUvsVirus organizado por la Comision Europea en abril 2020.	Πρόκειται για μια προσαρμοσμένη μηχανή αναζήτησης που χρησιμοποιεί το Google CSE για να ρωτήσει πολλές πηγές πληροφοριών συγχρόνως. Αναπτύχθηκε κατά τη διάρκεια του hackathon #EUvsVirus τον Απρίλιο του 2020	Սա հարմարեցված որոնման համակարգ է, որն օգտագործում է Google CSE-ն՝ միանգամից մի քանի փաստերի ստուգման աղբյուրների հարցումներ անելու համար: Այն մշակվել է #EUvsVirus հաքաթոնի ընթացքում 2020 թվականի ապրիլին
xnetwork_tip	This customised search engine uses Google CSE to perform cross-network searches on keywords. It may help to evaluate the virality of a disinformation campaign accross several platforms indexed by Google.	Ce moteur de recherche personnalisé utilise Google CSE pour interroger plusieurs plateformes à la fois. Il peut permettre d'évaluer la viralité d'une campagne de désinformation à travers plusieurs réseaux sociaux indexés par Google.	Este motor de busqueda usa Google CSE para interogar varias plataformas a la vez. Puede ayudar a evaluar la viralidad de una campana de desinformacion a traves de varias redes sociales.	Αυτή η προσαρμοσμένη μηχανή αναζήτησης χρησιμοποιεί το Google CSE για την πραγματοποίηση αναζητήσεων μεταξύ δικτύων με λέξεις-κλειδιά. Μπορεί να σας βοηθήσει να αξιολογήσετε τη βιωσιμότητα μιας καμπάνιας παραπληροφόρησης σε διάφορες πλατφόρμες που ευρετηριάζονται από την Google.	Այս հարմարեցված որոնման համակարգն օգտագործում է Google CSE-ն՝ հիմնաբառերի միջցանցային որոնումներ կատարելու համար: Դա կարող է օգնել գնահատել Google-ի կողմից ինդեքսավորված մի քանի հարթակներում ապատեղեկատվության քարոզարշավի վիրուսային լինելը:
twittersna_explication	This feature is not aimed for making large queries but to analyse emergence of disinformation. If you need to expand or relaunch your query, erase your previous results with the right orange-background cross, and submit again with your new parameters. 	Cette fonctionnalité n'est pas prévue pour de larges requêtes mais pour analyser l'émergence de désinformation. Si vous souhaitez élargir votre recherche, commencez par supprimer votre précédente requête en utilisant le bouton ad hoc (la croix blanche sur fond orange), puis relancez votre requête avec les nouveaux paramètres.	Esta herramienta permite analizar la emergencia  de desinformacion. No esta prevista para grandes busquedas. Si necesita ampliar o hacer otra busqueda, comience por suprimir los resultatos anteriores con el boton en forma de cruz con fondo naranja, y vuelva a repitir su consulta con otros parametros.	Αυτή η δυνατότητα δεν έχει ως στόχο να κάνει μεγάλα ερωτήματα αλλά να αναλύσει την εμφάνιση παραπληροφόρησης. Εάν πρέπει να αναπτύξετε ή να επανεκκινήσετε το ερώτημά σας, διαγράψτε τα προηγούμενα αποτελέσματά σας με το σωστό σταυρό πορτοκαλί φόντο και υποβάλετε ξανά τις νέες παραμέτρους.	Այս հատկությունը ուղղված է ոչ թե մեծ հարցումներ կատարելուն, այլ ապատեղեկատվության առաջացումը վերլուծելուն: Եթե Ձեզ անհրաժեշտ է ընդլայնել կամ վերագործարկել ձեր հարցումը, ջնջեք ձեր նախորդ արդյունքները ճիշտ նարնջագույն ֆոնային խաչով և նորից ներկայացրեք ձեր նոր պարամետրերով:
ocr_tip	This service works best with images with text in Latin script. If you have entered a URL and it has failed to extract the relevant text, you can right use the buttons below to send the image to Bing or Yandex. Both offer OCR service.	Cet outil fonctionne sur des images avec du texte en alphabet latin. Si vous utilisez une URL et qu'il ne fonctionne pas, vous pouvez envoyer l'image à Bing ou Yandex en utilisant les boutons ci-dessous.	Esta herramienta funciona con imágenes con texto en alfabeto latino. Si usa una URL y no functiona, puede mandar la imagen a Bing o Yandex que ofrecen un servicio similar.	Αυτή η υπηρεσία λειτουργεί καλύτερα με εικόνες με κείμενο σε λατινικό σενάριο. Εάν έχετε εισαγάγει μια διεύθυνση URL και δεν έχει εξαγάγει το σχετικό κείμενο, μπορείτε να χρησιμοποιήσετε τα παρακάτω κουμπιά για να στείλετε την εικόνα στο Bing ή στο Yandex. Και οι δύο προσφέρουν υπηρεσία OCR.	Այս ծառայությունը լավագույնս աշխատում է լատինատառ տեքստով պատկերներով: Եթե մուտքագրել եք URL, և այն չի կարողացել հանել համապատասխան տեքստը, կարող եք ճիշտ օգտագործել ստորև բերված կոճակները՝ պատկերը Bing-ին կամ Yandex-ին ուղարկելու համար: Երկուսն էլ առաջարկում են OCR ծառայություն:
intro_tip	"If the input link does not work, enter the video and copy the link manually instead of using the facebook's option: ""copy link""."	"Si le lien d'entrée ne fonctionne pas, entrez la vidéo et copiez le lien manuellement au lieu d'utiliser l'option de facebook: ""copier le lien""."	"Si el enlace de entrada no funciona, ingrese el video y copie el enlace manualmente en lugar de usar la opción de Facebook: ""copiar enlace""."	"Εάν ο σύνδεσμος εισαγωγής δεν λειτουργεί, εισαγάγετε το βίντεο και αντιγράψτε τον σύνδεσμο χειροκίνητα αντί να χρησιμοποιήσετε την επιλογή του facebook: ""copy link""."	Եթե մուտքագրման հղումը չի աշխատում, մուտքագրեք տեսանյութը և ձեռքով պատճենեք հղումը facebook-ի «պատճենել հղումը» տարբերակը օգտագործելու փոխարեն։
title_tip	What is this	Qu'est-ce que c'est ?	¿Qué es esto?	Τι είναι αυτό	 Ինչ է սա 
