	en	fr	es	el	hy
keyframes_tip	With the contextual menu (right click) you can query multiple reverse image search engines or use the magnifier and forensic tools on each keyframe.	Avec le menu contextuel (clic droit) vous pouvez utiliser plusieurs moteurs de recherches d'images ou utiliser la loupe ou l'outil forensic sur chaque image clé.	Con el menú contextual (clic derecho), puede Ud. utilizar varios motores de busqueda inversa de imagen o utilizar la lupa o la herramienta de forensic sobre cada imagen clave	Με το αναδυόμενο μενού (δεξί κλικ), μπορείτε να υποβάλετε ερώτημα πολλαπλές αντίστροφες αναζητήσεις εικόνων ή να χρησιμοποιήσετε το μεγεθυντικό φακό και τo εργαλείo ανάλυσης αυθεντικότητας για κάθε χαρακτηριστικό καρέ.	Համատեքստային մենյուի միջոցով (աջ սեղմումով) կարող եք հարցումներ կատարել մի քանի հակադարձ պատկերների որոնման համակարգերում կամ օգտագործել խոշորացույցը և դատաբժշկական գործիքները յուրաքանչյուր հիմնական կադրի վրա:
magnifier_tip	If you click on the button below the image url will be automatically copied to your clipboard. Then you will be redirected to Google Reverse Search website. You just have to paste and click on search by image url to find out more information about your image.	Si vous cliquez sur le bouton ci-dessous, l’URL de l’image sera automatiquement copiée dans votre presse-papiers. Ensuite, vous serez redirigé vers le site de recherche d'images inversées Google. Vous avez juste à coller et cliquez sur ''recherche par image'' pour en savoir plus sur votre image.	Si hace clic en el botón debajo de la url de la imagen se copiará automáticamente a su portapapeles. A continuación, será redirigido a Google Reverse Search sitio web. Sólo tienes que pegar y hacer clic en la búsqueda la imagen para obtener más información sobre su imagen.	Εάν επιλέξετε το πλήκτρο από κάτω, το url της εικόνας θα αντιγραφεί αυτόματα στο πρόχειρο σας. Στη συνέχεια θα μεταφερθείτε στην ιστοσελίδα της αντίστροφης οπτικής αναζήτησης Google. Απλά πρέπει να επικολλήσετε και να επιλέξετε την αναζήτηση με url εικόνας για να βρείτε περισσότερες πληροφορίες σχετικά με την εικόνα σας.	Եթե սեղմեք կոճակի վրա, պատկերի url-ն ինքնաբերաբար կպատճենվի ձեր clipboard-ում: Այնուհետև դուք կվերահղվեք Google Reverse Search կայք: Դուք պարզապես պետք է տեղադրեք և սեղմեք որոնում ըստ պատկերի url-ի վրա՝ ձեր պատկերի մասին ավելի շատ տեղեկություններ իմանալու համար:
thumbnails_tip	If you click on the images below they will be used by the reverse search engine(s) you selected.	Si vous cliquez sur les images ci-dessous, elles seront utilisées par le(s) moteur(s) de recherche inversé(s) que vous avez sélectionné.	Si hace clic en las imágenes de abajo, serán utilizadas por el motor de búsqueda inversa seleccionado.	Αν επιλέξετε τις παρακάτω εικόνες θα χρησιμοποιηθούν από την μηχανή(ες)  αντίστροφης οπτικής αναζήτησης που έχετε επιλέξει.	Եթե սեղմեք ստորև ներկայացված պատկերների վրա, դրանք կօգտագործվեն ձեր ընտրած հակադարձ որոնման համակարգ(ների) կողմից:
twittersna_timeline_tip	Timeline of the tweets retrieved from your query. You can zoom into the timeline with the slider below. You can check the peaks of propagation (calculated as a sum of all retweets per day).	Chronologie des tweets extraits de votre requête. Vous pouvez zoomer dans la frise chronologique avec le curseur en dessous. Vous pouvez vérifier les pics de propagation (calculés comme une somme de tous les retweets par jour).	Línea de tiempo de los tweets recuperados con su consulta. Puede hacer un zoom en la línea de tiempo con el deslizador de la parte inferior. Puede comprobar los picos de propagación (calculados como la suma de todos los retweets por día).	Χρονοδιάγραμμα των tweets που ανακτήθηκαν από το ερώτημά σας. Μπορείτε να κάνετε ζουμ στο χρονοδιάγραμμα με το ρυθμιστικό παρακάτω. Μπορείτε να ελέγξετε τις κορυφές διάδοσης (υπολογίζονται ως άθροισμα όλων των retweets ανά ημέρα).	Ձեր հարցումից վերցված թվիթերի ժամանակացույցը: Դուք կարող եք մեծացնել ժամանակացույցը ստորև բերված սահիչով: Դուք կարող եք ստուգել տարածման գագաթնակետերը (հաշվարկվում են որպես օրական բոլոր ռեթվիթների գումար):
twittersna_tweetnb_tip	Metrics retrieved for your query. If you want to assess the newsworthiness of your query, you can compare with Twitter trends : https://twitter.com/i/trends	Mesures correspondants à votre requête. Si vous voulez vérifier l'intérêt journalistique et la viralité de votre requête, vous pouvez comparer avec les tendances Twitter : https://twitter.com/i/trends	Medidas correspondiente a su búsqueda. Si quiere evaluar el interés periodístico o la viralidad de su búsqueda, puede comparar con las tendencias Twitter : https://twitter.com/i/trends	Mετρήσεις που ανακτήθηκαν για το ερώτημά σας. Αν θέλετε να αξιολογήσετε την αξιοπιστία του ερωτήματός σας, μπορείτε να συγκρίνετε με τις τάσεις του Twitter: https://twitter.com/i/trends	Ձեր հարցման համար վերցված չափումներ: Եթե ցանկանում եք գնահատել ձեր հարցման արդիականությունը, կարող եք համեմատել Twitter-ի միտումների հետ՝ https://twitter.com/i/trends
twittersna_most_retweet_tip	This pie-chart shows the top 20 retweeted users with their number of retweets. Click on a pie segment to see the corresponding tweets.	Ce graphique montre les 20 utilisateurs les plus retweetés avec leur nombre de retweets. Cliquez sur un segment pour voir les tweets correspondants.	Este gráfico muestra los 20 usuarios más activos con su número de retweets. Haz clic en un segmento para ver los tweets correspondientes.	Αυτό το γράφημα πίτας δείχνει τους 20 κορυφαίους χρήστες που έχουν πραγματοποιήσει retweet με τον αριθμό των retweets. Κάντε κλικ σε ένα τμήμα πίτας για να δείτε τα αντίστοιχα tweets.	Այս կարկանդակ աղյուսակը ցույց է տալիս լավագույն 20 ռեթվիթ արված օգտատերերին՝ իրենց ռեթվիթների քանակով: Կտտացրեք կարկանդակ հատվածի վրա՝ համապատասխան թվիթերը տեսնելու համար:
twittersna_most_likes_tip	This pie-chart shows the top 20 users with most liked tweets and their number of likes. Click on a pie segment to see the corresponding tweets.	Ce graphique montre les 20 premiers utilisateurs dont les tweets ont été les plus appréciés avec leur nombre de ''j'aime''. Cliquez sur un segment pour voir les tweets correspondants.	Este gráfico muestra los primeros 20 usuarios cuyos tweets han sido más apreciados con su número de ''me gusta''. Haz clic en un segmento para ver los tweets correspondientes.	Αυτό το γράφημα πίτας δείχνει τους κορυφαίους 20 χρήστες με τα πιο δημοφιλή tweets και τον αριθμό των likes. Κάντε κλικ σε ένα τμήμα πίτας για να δείτε τα αντίστοιχα tweets.	Այս կարկանդակ աղյուսակը ցույց է տալիս ամենաշատ հավանած թվիթերի 20 լավագույն օգտատերերը և նրանց հավանումների քանակը: Կտտացրեք կարկանդակ հատվածի վրա՝ համապատասխան թվիթերը տեսնելու համար:
twittersna_most_active_tip	This pie-chart shows the top 20 most active users with their number of tweets. Click on a pie segment to see the corresponding tweets.	Ce graphique montre les 20 premiers utilisateurs les plus actifs avec leur nombre de tweets. Cliquez sur un segment pour voir les tweets correspondants.	Este gráfico muestra los 20 primeros usuarios más activos con su número de tweets. Haz clic en un segmento para ver los tweets correspondientes.	Αυτό το γράφημα πίτας δείχνει τους 20 πιο ενεργούς χρήστες με τον αριθμό των tweets τους. Κάντε κλικ σε ένα τμήμα πίτας για να δείτε τα αντίστοιχα tweets.	Այս կարկանդակ աղյուսակը ցույց է տալիս ամենաակտիվ 20 օգտատերերին՝ իրենց թվիթերի քանակով: Կտտացրեք կարկանդակ հատվածի վրա՝ համապատասխան թվիթերը տեսնելու համար:
twittersna_most_mentions_tip	This pie-chart shows the 20 top most mentioned users with their number of mentions. Click on a pie segment to see the corresponding tweets.	Ce graphique montre les 20 utilisateurs les plus cités avec leur nombre de mentions. Cliquez sur un segment pour voir les tweets correspondants.	Este gráfico muestra los 20 usuarios más mencionados con su número de menciones. Haga clic en un segmento para ver los tweets correspondientes.	Αυτό το γράφημα πίτας δείχνει τους 20 κορυφαίους χρήστες που έχουν γίνει αναφορά με τον αριθμό των αναφορών τους. Κάντε κλικ σε ένα τμήμα πίτας για να δείτε τα αντίστοιχα tweets.	Այս կարկանդակ աղյուսակը ցույց է տալիս ամենաշատ հիշատակված 20 օգտվողներին՝ իրենց հիշատակումների քանակով: Կտտացրեք կարկանդակ հատվածի վրա՝ համապատասխան թվիթերը տեսնելու համար:
twittersna_heatmap_tip	The heatmap shows activity per hour. Darker squares show more activity. It may help you to detect bots or coordinated behaviour. Click on a square to see the corresponding tweets.	Le graphique indique l'activité par heure. Les carrés plus foncés indiquent une activité plus importante. Cela peut vous aider à détecter les bots ou les comportements coordonnés. Cliquez sur une case pour voir les tweets correspondants.	El mapa de calor muestra la actividad por hora. Los cuadros más oscuros muestran más actividad. Puede ayudarte a detectar bots o el comportamiento Haz clic en un cuadrado para ver los tweets correspondientes.	Ο χάρτης θερμότητας δείχνει τη δραστηριότητα ανά ώρα. Τα πιο σκοτεινά τετράγωνα δείχνουν περισσότερη δραστηριότητα. Μπορεί να σας βοηθήσει να εντοπίσετε ρομπότ ή συντονισμένη συμπεριφορά. Κάντε κλικ σε ένα τετράγωνο για να δείτε τα αντίστοιχα tweets.	Ջերմային քարտեզը ցույց է տալիս ժամում ակտիվությունը: Ավելի մուգ քառակուսիները ցույց են տալիս ավելի ակտիվություն: Դա կարող է օգնել ձեզ հայտնաբերել բոտերին կամ համակարգված վարքագիծը: Սեղմեք քառակուսու վրա՝ համապատասխան թվիթերը տեսնելու համար:
twittersna_hashtag_graph_tip	This graphs shows you the hashtags (and their numbers) retrieved with their co-occurrences between them. Thicker edges show more co-occurences between the hashtags. You can see the corresponding tweets by clicking on a node. If you want to see the intersection of two nodes, click on the bigger node then type the second hashtag in the search box.	Ce graphique vous montre les hashtags (et leur nombre) récupérés avec leurs cooccurrences entre eux. Plus un arc est épais, plus il montre de co-occurrences entre les hashtags. Vous pouvez voir les tweets correspondants en cliquant sur un nœud. Si vous voulez voir l'intersection de deux nœuds, cliquez sur le plus gros nœud puis écrivez le deuxième hashtag dans la boîte de recherche.	Este gráfico muestra los hashtags (y sus números) recuperados con sus co-ocurrencias entre ellos. Los enlaces más gruesos muestran más co-ocurrencias entre los hashtags. Puedes ver los tweets correspondientes clicqueando en un nodo. Si quiere ver la intersección de dos nodos, haga clic en el nodo más grande y luego escriba el segundo hashtag en el cuadro de búsqueda.	Σε αυτά τα γραφήματα εμφανίζονται τα hashtag (και οι αριθμοί τους) που ανακτήθηκαν με τις συν-εμφανίσεις τους μεταξύ τους. Τα παχύτερα άκρα δείχνουν περισσότερες συν-εμφανίσεις μεταξύ των hashtags. Μπορείτε να δείτε τα αντίστοιχα tweets κάνοντας κλικ σε έναν κόμβο. Εάν θέλετε να δείτε τη διασταύρωση δύο κόμβων, κάντε κλικ στον μεγαλύτερο κόμβο και, στη συνέχεια, πληκτρολογήστε το δεύτερο hashtag στο πλαίσιο αναζήτησης.	Այս գծապատկերները ցույց են տալիս ձեզ վերցված հեշթեգները (և դրանց թվերը)՝ դրանց միջև եղած համակցությամբ: Ավելի հաստ եզրերը ցույց են տալիս հեշթեգների միջև ավելի շատ համակցություններ: Դուք կարող եք տեսնել համապատասխան թվիթները՝ սեղմելով հանգույցի վրա: Եթե ցանկանում եք տեսնել երկու հանգույցների խաչմերուկը, սեղմեք ավելի մեծ հանգույցի վրա, ապա որոնման վանդակում մուտքագրեք երկրորդ հեշթեգը:
twittersna_wordcloud_tip	This word cloud shows you the top words used in the tweet collection of your query (without the query words). You can click on each word to see the corresponding tweets.	Ce nuage de mots vous montre les principaux mots utilisés dans la collection de tweets de votre requête (sans les mots de la requête). Vous pouvez cliquer sur chaque mot pour voir les tweets correspondants.	Esta nube de palabras le muestra las palabras más usadas en la colección de tweets de su consulta (sin las palabras de la consulta). Puedes hacer clic en cada palabra para ver los tweets correspondientes.	Αυτό το σύννεφο λέξεων εμφανίζει τις κορυφαίες λέξεις που χρησιμοποιούνται στη συλλογή tweet του ερωτήματός σας (χωρίς τις λέξεις ερωτήματος). Μπορείτε να κάνετε κλικ σε κάθε λέξη για να δείτε τα αντίστοιχα tweets.	Այս բառային ամպը ձեզ ցույց է տալիս ձեր հարցման թվիթերի հավաքածուի մեջ օգտագործված լավագույն բառերը (առանց հարցման բառերի): Դուք կարող եք սեղմել յուրաքանչյուր բառի վրա՝ համապատասխան թվիթերը տեսնելու համար:
twittersna_urls_tip	Sorted list of most shared urls in the collection of tweets. You can relaunch a TwitterSNA query with any link by selecting it (check box) and using the TwitterSNA button.	Liste triée des urls les plus partagées dans la collection de tweets. Vous pouvez relancer une requête TwitterSNA avec n'importe quel lien en le sélectionnant (case à cocher) et en utilisant le bouton TwitterSNA.	Lista ordenada de las urls más compartidas en la colección de tweets. Puede relanzar una consulta de TwitterSNA con cualquier enlace seleccionándolo (casilla de verificación) y usando el botón de TwitterSNA.	Ταξινομημένη λίστα με τις περισσότερες κοινές διευθύνσεις URL στη συλλογή tweets. Μπορείτε να επανεκκινήσετε ένα ερώτημα TwitterSNA με οποιονδήποτε σύνδεσμο επιλέγοντας το (πλαίσιο ελέγχου) και χρησιμοποιώντας το κουμπί TwitterSNA.	Թվիթերների հավաքածուի ամենաշատ համօգտագործվող url-ների տեսակավորված ցուցակը: Դուք կարող եք վերագործարկել TwitterSNA հարցումը ցանկացած հղումով՝ ընտրելով այն (ստուգեք վանդակը) և օգտագործելով TwitterSNA կոճակը:
twittersna_user_graph_tip	User accounts graph	Graphe de comptes utilisateurs	Grafo de cuentas de usuarios	Γράφημα λογαριασμών χρηστών	Օգտագործողի հաշիվների գծապատկեր
twittersna_export_graph_tip	Export and view graph in gexf	Exporter et visualiser le graphe en format gexf	Exportar y visualizar el grafo en formato gexf	Εξαγωγή και προβολή γραφήματος στο gexf	Արտահանել և դիտել գրաֆիկը gexf-ում
forensic_tip	All forensic filters displayed below are aimed at detecting picture signal alteration such as incoherences in compression, frequencies, jpeg blocks, etc... More filters highlight some specific zone, more likely the image could be tampered. Note that alteration in the signal can be also triggered by light conditions, resampling or compressing the image without intention to alter its semantics. You can click on each filter to see it on top of the image you want to check. You can then use the vertical slider to compare the filter output with the initial picture.	Tous les filtres forensic présentés ci-dessous visent à détecter les altérations du signal dans l'image telles que les incohérences dans la compression, les fréquences, les blocs jpeg, etc. Plus les filtres mettent en évidence une zone spécifique, plus il est probable que l'image soit altérée. Notez que l'altération du signal peut également être déclenchée par des conditions de lumière, en rééchantillonnant ou en compressant l'image sans intention d'en altérer la sémantique. Vous pouvez cliquer sur chaque filtre pour le voir sur l'image que vous voulez vérifier. Vous pouvez alors utiliser le curseur vertical pour comparer la sortie du filtre avec l'image initiale.	Todos los filtros forensics que se muestran a continuación tienen como objetivo detectar una posible alteración de la señal de la imagen, como incoherencias en la compresión, frecuencias, bloques jpeg, etc... Cuando más filtros resaltan alguna zona específica, es más probable que la imagen pueda ser alterada. Obsérvese que la alteración de la señal también puede ser provocada por condiciones de luz, remuestreo o compresión de la imagen sin intención de alterar su semántica. Puede hacer clic en cada filtro para verlo encima de la imagen que quiere comprobar. Puede utilizar el control deslizante vertical para comparar la salida del filtro con la imagen inicial.	Όλα τα φίλτρα ανίχνευσης αυθεντικότητας που εμφανίζονται παρακάτω στοχεύουν στην ανίχνευση αλλαγής σήματος εικόνας, όπως ασυνέπειες στη συμπίεση, συχνότητες, μπλοκ jpeg, κ.λπ ...  Όσο περισσότερα φίλτρα επισημαίνουν κάποια συγκεκριμένη ζώνη, τόσο πιθανότερα η εικόνα θα μπορούσε να έχει αλλοιωθεί. Σημειώστε ότι η αλλαγή του σήματος μπορεί επίσης να προκληθεί από συνθήκες φωτισμού, επαναπροσδιορισμός ή συμπίεση της εικόνας χωρίς πρόθεση να αλλάξει τη σημασιολογία της. Μπορείτε να κάνετε κλικ σε κάθε φίλτρο για να το δείτε πάνω στην εικόνα που θέλετε να ελέγξετε. Στη συνέχεια, μπορείτε να χρησιμοποιήσετε το κατακόρυφο ρυθμιστικό για να συγκρίνετε την έξοδο του φίλτρου με την αρχική εικόνα.	Ստորև ներկայացված բոլոր դատաբժշկական զտիչները նպատակ ունեն հայտնաբերել պատկերի ազդանշանի փոփոխությունները, ինչպիսիք են սեղմման, հաճախականությունների, jpeg բլոկների և այլնի անհամապատասխանությունները... Ավելի շատ զտիչներ ընդգծում են որոշակի գոտի, ավելի հավանական է, որ պատկերը կարող է կեղծվել: Նկատի ունեցեք, որ ազդանշանի փոփոխությունը կարող է առաջանալ նաև լուսային պայմանների պատճառով՝ պատկերը նորից նմուշառելով կամ սեղմելով՝ առանց դրա իմաստաբանությունը փոխելու մտադրության: Դուք կարող եք սեղմել յուրաքանչյուր ֆիլտրի վրա՝ տեսնելու այն պատկերի վերևում, որը ցանկանում եք ստուգել: Այնուհետև կարող եք օգտագործել ուղղահայաց սահիչը՝ ֆիլտրի ելքը նախնական նկարի հետ համեմատելու համար:
metadata_tip	Most social networks platforms are getting rid of metadata in pictures and videos. If, as a journalist or fact-checker, you want to ensure the picture or video is an original UGC production, ask for the original file and you can check it here as a local file to see its metadata.	La plupart des plateformes de réseaux sociaux se débarrassent des métadonnées des photos et des vidéos. Si, en tant que journaliste ou fact-checker, vous voulez vous assurer que la photo ou la vidéo est une production UGC originale, demandez le fichier original et vous pourrez le vérifier ici en tant que fichier local pour voir ses métadonnées.	La mayoría de las plataformas de redes sociales se están deshaciendo de los metadatos de las fotos y los videos. Si, como periodista o fact-checker, quiere asegurarse de que la foto o el vídeo es una producción original de UGC, pida el archivo original y puede comprobarlo aquí como un archivo local para ver sus metadatos.	Οι περισσότερες πλατφόρμες κοινωνικών δικτύων αφαιρούν τα μεταδεδομένα σε εικόνες και βίντεο. Εάν, ως δημοσιογράφος ή ελεγκτής γεγονότων, θέλετε να βεβαιωθείτε ότι η εικόνα ή το βίντεο είναι μια πρωτότυπη παραγωγή περιεχόμενου που δημιουργήθηκε από τον χρήστη, ζητήστε το αρχικό αρχείο και μπορείτε να το ελέγξετε εδώ ως τοπικό αρχείο για να δείτε τα μεταδεδομένα του.	Սոցցանցերի շատ հարթակներ ազատվում են նկարների և տեսանյութերի մետատվյալներից։ Եթե, որպես լրագրող կամ փաստ ստուգող, ցանկանում եք համոզվել, որ նկարը կամ տեսանյութը օրիգինալ UGC արտադրություն է, խնդրեք բնօրինակ ֆայլը և կարող եք ստուգել այն այստեղ որպես տեղական ֆայլ՝ դրա մետատվյալները տեսնելու համար:
